{
  "version": 3,
  "study_name": "something@moz",
  "branch": "medium-r√•re",
  "addon_version": "0.1.1",
  "shield_version": "1.2.3",
  "testing": true,
  "type": "shield-study",
  "data": {
    "study_state": "ended-positive",
    "study_state_fullname": "Df557JaczQBPksw",
    "attributes": {
      "NwGadQkr": "jU1am0",
      "j9O": "q",
      "7iR": "i",
      "cT0D": "9H"
    }
  }
}
